{
  "profileVersion": "1",
  "deploymentId": "bad-synthetic-demo-01",
  "siteId": "BAD",
  "display": {
    "productName": "PROMueve Nexus",
    "siteName": "Deployment sintético BAD (demo)"
  },
  "persistenceMode": "session-only",
  "modules": [
    {
      "moduleId": "farmacia",
      "enabled": true,
      "qualificationState": "IMPLEMENTED_NOT_QUALIFIED"
    },
    {
      "moduleId": "reuma",
      "enabled": true,
      "qualificationState": "IMPLEMENTED_NOT_QUALIFIED"
    }
  ]
}
