{
  "profileVersion": "1",
  "deploymentId": "bad-synthetic-demo-home-01",
  "siteId": "BAD",
  "display": {
    "productName": "NEXus",
    "siteName": "Entorno de demostración"
  },
  "persistenceMode": "session-only",
  "modules": [
    {
      "moduleId": "farmacia",
      "enabled": true,
      "qualificationState": "IMPLEMENTED_NOT_QUALIFIED"
    },
    {
      "moduleId": "reuma",
      "enabled": true,
      "qualificationState": "QUALIFIED_FOR_SITE",
      "qualificationEvidence": "Synthetic Home demo fixture (issue #403); not a real hospital qualification"
    }
  ]
}
